Book Id,Title,Author,Author l-f,Additional Authors,ISBN,ISBN13,My Rating,Average Rating,Publisher,Binding,Number of Pages,Year Published,Original Publication Year,Date Read,Date Added,Bookshelves,Bookshelves with positions,Exclusive Shelf,My Review,Spoiler,Private Notes,Read Count,Recommended For,Recommended By,Owned Copies,Original Purchase Date,Original Purchase Location,Condition,Condition Description,BCID
28789352,The End of Average: How to Succeed in a World that Values Sameness,Todd Rose,"Rose, Todd",,,,3,4.05,Penguin,Kindle Edition,232,2016,2016,01/09/2020,28/08/2020,non-fiction,non-fiction (#107),read,"This book is interesting and very readable, but I find its arguments unconvincing. The main thrust is that the concept of the average does a poor job of describing variability and individuality, and that this has to stop. I find this disappointing because as an academic - in developmental psychology of all disciplines! - Rose must know that researchers are aware that the within/between distinction is not new, and statistics has good ways of dealing with variability (the normal distribution, mixed effects modelling, and so on). More time could have been spent on how the concept of an average is actually useful (e.g. in medical screening), and of course we only base hiring decisions and educational selection on the average because it's the most efficient way of dealing with an overwhelming number of applicants/students. The book is quite idealistic, and its examples are mostly restricted to the North American context. ",,,1,,,0,,,,,
25933717,Age of Iron,J.M. Coetzee,"Coetzee, J.M.",,,,2,3.84,Penguin,Kindle Edition,197,2015,1990,28/08/2020,23/08/2020,fiction,fiction (#161),read,"I didn't enjoy this very much. The synopsis sounded so interesting but it's quite misleading. Yes, this story is set in the later stages of apartheid but really it's about an old woman who befriends a squatter on her property and loses her mind as she dies from cancer. The writing got increasingly stream-of-consciousness in style, which I personally didn't care for as it just wasn't clear at times what was going on or why. ",,,1,,,0,,,,,
11233289,Into Thin Air: A Personal Account of the Mt. Everest Disaster,Jon Krakauer,"Krakauer, Jon",,1447200187,9.78E+12,4,4.18,Pan Books,Paperback,319,2011,1997,23/08/2020,17/08/2020,non-fiction,non-fiction (#106),read,"Hmm, 3 stars for the content but 4 for the writing, so 3.5 overall. There's a lot to be said about this book because of its backstory. At its heart it's a retelling of 'the Everest disaster' that Krakauer experienced, which was originally published as a magazine article. However, there were rival perspectives and retellings and so there's a big focus on factual integrity which unfortunately took away from the storytelling for me. In addition to this focus, or perhaps because of it, I found it quite confusing to figure out what was actually happening at the point of the storm hitting, and the multiple climbing parties and characters involved also made it confusing at times. That said, the writing is excellent and I'd still recommend it.",,,1,,,0,,,,,
44532840,The Dark Side of the Mind: True Stories from My Life as a Forensic Psychologist,Kerry Daynes,"Daynes, Kerry",,,,4,4.12,Cassell Illustrated,Kindle Edition,304,2019,2019,11/08/2020,08/08/2020,non-fiction,non-fiction (#105),read,"This part-professional, part-personal memoir Daynes' career as a forensic psychologist is very similar to Unnatural Causes by Richard Shepherd (although much less harrowing and obviously focused on psychology rather than pathology). It's very well written and the stories of Daynes' past patients and experiences are engaging. ",,,1,,,0,,,,,
34006942,All the Light We Cannot See,Anthony Doerr,"Doerr, Anthony",,1501173219,9.78E+12,4,4.33,Scribner,Paperback,531,2017,2014,09/08/2020,31/07/2020,fiction,fiction (#160),read,,,,1,,,0,,,,,
23454792,"Me, Myself, and Us: The Science of Personality and the Art of Well-Being",Brian Little,"Little, Brian",,,,2,3.93,PublicAffairs,Kindle Edition,290,2014,2012,30/07/2020,25/07/2020,"non-fiction, psychology",non-fiction (#104),read,"I heard about Brian Little in Susan Cain's 'Quiet Revolution' and thought I'd like to know more about his ideas on free trait theory. Unfortunately, Cain's is a MUCH better book despite being more narrowly focused. For me, Little's writing is overly chatty and way too many pages were spent on anecdotes. Towards the end I had to start skipping parts because it just wasn't holding my attention.",,,1,,,0,,,,,
15705259,Zero Degrees of Empathy: A New Theory of Human Cruelty,Simon Baron-Cohen,"Baron-Cohen, Simon",,,,5,3.78,Penguin,Kindle Edition,184,2011,2011,25/07/2020,23/07/2020,"non-fiction, psychology",non-fiction (#103),read,"I found this a totally engrossing read. Baron-Cohen sets out his ideas on how the psychological mechanisms of empathising and systemising can lead to lack of empathy, splitting this into zero-negative (personality disorders) and zero-positive (autism spectrum disorders). He also delves into causal factors like attachment and throws in some neuroscience too. I found the writing lucid, and I think the book delivers its messages without being overly verbose.",,,1,,,0,,,,,
28922,An Artist of the Floating World,Kazuo Ishiguro,"Ishiguro, Kazuo",,571225365,9.78E+12,2,3.76,Faber and Faber,Paperback,206,2005,1986,22/07/2020,17/07/2020,fiction,fiction (#160),read,"After enjoying Never Let Me Go and The Remains of the Day I was disappointed with this one. It always felt like it was leading up to something, but that something never transpired. Maybe you need to know quite a lot about Japan's pre/post-war transition to understand this?",,,1,,,0,,,,,
35792164,"Revolution (The History of England, #4)",Peter Ackroyd,"Ackroyd, Peter",,1509811478,9.78E+12,3,4.04,Pan Macmillan,Paperback,416,2017,2016,22/07/2020,10/07/2020,"non-fiction, history","non-fiction (#102), fiction (#159)",read,"I like the books in this series less and less over time. I know it's only a brief overview of 'the long 18th century', but it seemed to cut corners/leapfrog over certain things. I'd have liked more commentary on the broad themes and ideas that developed over the century (i.e. people talk about this century as being characterised by revolution, but this didn't really come across to me in the book). Also, as I make notes as I go along, I get frustrated when Ackroyd makes reference to, e.g. a 'war' that started in '1795', prompting a distracting Googling session!",,,1,,,0,,,,,
45285943,The Beekeeper of Aleppo,Christy Lefteri,"Lefteri, Christy",,,9.78E+12,4,4.23,Zaffre (imprint of Allen and Unwin),Paperback,378,2019,2019,10/07/2020,05/07/2020,fiction,fiction (#158),read,,,,1,,,0,,,,,
33601829,Americanah,Chimamanda Ngozi Adichie,"Adichie, Chimamanda Ngozi",,,,5,4.31,Fourth Estate,Kindle Edition,610,2017,2013,05/07/2020,20/06/2020,fiction,fiction (#157),read,"A brilliant read. A transcontinental novel dealing with big themes like race, immigration, and identity, all told through an absorbing, sharply written narrative.",,,1,,,0,,,,,
7575221,"America, Empire of Liberty: A New History",David   Reynolds,"Reynolds, David",,141033673,9.78E+12,5,4.19,Penguin,Paperback,673,2010,2009,04/07/2020,12/06/2020,"non-fiction, history","non-fiction (#101), history (#15)",read,"This is a tour de force! A very good balance between breadth and depth. Reynolds quotes regularly from direct sources, giving greater insight into the events and people discussed. Excellent quote from the final page: the history of the United States is ""shot through with paradox - the empire forged by anti-imperialists, the land of liberty that rested on slavery, the secular state energized by godly ambition."" ",,,1,,,0,,,,,
512710,North and South,Elizabeth Gaskell,"Gaskell, Elizabeth",Patricia Ingham,140434240,9.78E+12,2,4.13,Penguin Classics,Paperback,496,1996,1855,29/06/2020,12/06/2020,fiction,fiction (#156),read,"What a slog this was. There were some interesting events and themes, but not enough to justify the length of the book.",,,1,,,0,,,,,
35061545,Little Fires Everywhere,Celeste Ng,"Ng, Celeste",,,,4,4.1,"Little, Brown Book Group",Kindle Edition,354,2017,2017,10/06/2020,06/06/2020,fiction,fiction (#155),read,,,,1,,,0,,,,,
17318692,How Music Works,David Byrne,"Byrne, David",,1938073533,9.78E+12,3,3.96,McSweeney's,Paperback,374,2013,2012,08/06/2020,02/06/2020,non-fiction,non-fiction (#100),read,"This one was hit-and-miss for me. David Byrne is clearly a sensitive and intellectual producer and consumer of music, and his candid insights into the music industry were interesting. But too often this slipped into autobiographical drudgery (more like 'How MY Music Works'), and often chapters felt disorganised and lacking in direction. ",,,1,,,0,,,,,
51024500,Machines Like Me,Ian McEwan,"McEwan, Ian",,1529111250,9.78E+12,4,3.59,Vintage,Paperback,320,2020,2019,30/05/2020,27/05/2020,fiction,fiction (#154),read,4.5 / 5,,,1,,,0,,,,,
1225818,The River,Tricia Wastvedt,"Wastvedt, Tricia",,014101685X,9.78E+12,2,3.19,Penguin,Paperback,352,2005,2004,27/05/2020,23/05/2020,fiction,fiction (#153),read,"A difficult read due to the complex web of characters and time-shifting, exacerbated by a writing style which I didn't care for. ",,,1,,,0,,,,,
53208167,The Remains of the Day,Kazuo Ishiguro,"Ishiguro, Kazuo",,571154913,9.78E+12,4,4.12,Faber and Faber,Paperback,250,1993,1989,22/05/2020,19/05/2020,fiction,fiction (#152),read,A novel about pathological devotion and loyalty,,,1,,,0,,,,,
27857238,Suspicious Minds: Why We Believe Conspiracy Theories,Rob Brotherton,"Brotherton, Rob",,,,3,3.85,Bloomsbury Sigma,Kindle Edition,304,2015,2015,08/05/2020,02/05/2020,"non-fiction, psychology",non-fiction (#99),read,"This seems like a good general introduction to the field with lots of references to follow up on. A very easy read, but too much time is spent discussing the minutiae of actual conspiracy theories at the expense of analysing why people believe them. Other parts of the book also felt unnecessarily padded out. ",,,1,,,0,,,,,
46250918,Uncommon Knowledge: the Economist Explains,Tom Standage,"Standage, Tom",,,,4,3.62,Economist Books,Kindle Edition,272,2019,2019,02/05/2020,19/04/2020,non-fiction,non-fiction (#98),read,An interesting compendium of bitesize articles on a range of interesting subjects.,,,1,,,0,,,,,
11062402,Half of a Yellow Sun,Chimamanda Ngozi Adichie,"Adichie, Chimamanda Ngozi",,,,5,4.33,Harper Perennial,Kindle Edition,562,2009,2006,02/05/2020,19/04/2020,fiction,fiction (#151),read,"A brilliant, complex novel set around the Nigerian civil war.",,,1,,,0,,,,,
50728243,The Martian,Andy Weir,"Weir, Andy",,,,3,4.4,Cornerstone Digital,Kindle Edition,384,2020,2012,19/04/2020,17/04/2020,fiction,"fiction (#150), non-fiction (#97)",read,"It's painfully obvious that this is written by a science-loving ex-computer programmer. I glazed over on several occasions when Weir went into way too much detail, using way too much jargon. I feel this would have been a much better story if there had been more emphasis on character development and what it would actually feel like to be stranded on Mars. I found Watney's character annoying chipper and unfunny.",,,1,,,0,,,,,
17371662,NW,Zadie Smith,"Smith, Zadie",,,,4,3.46,The Penguin Press,Kindle Edition,416,2012,2012,17/04/2020,13/04/2020,fiction,fiction (#149),read,I quite enjoyed this - a vivid character study touching on themes of social class and mobility in London amongst many other things.,,,1,,,0,,,,,
26826986,"Civil War (The History of England, #3)",Peter Ackroyd,"Ackroyd, Peter",,1447271696,9.78E+12,4,3.98,Pan Books (UK),Paperback,512,2015,2014,11/04/2020,28/03/2020,"non-fiction, history","non-fiction (#96), history (#3)",read,"Another great instalment in the History of England series. Would have liked more analysis/summarising throughout, and also more focus on the social and scientific changes of the period.",,,1,,,0,,,,,
34804171,Behave: The Biology of Humans at Our Best and Worst,Robert M. Sapolsky,"Sapolsky, Robert M.",,,,2,4.42,Vintage Digital,Kindle Edition,800,2017,2017,11/04/2020,12/03/2020,"non-fiction, psychology",non-fiction (#92),read,"""We've covered lots of ground,"" Sapolsky says in the epilogue at the end of this marathon. No shit. For me, this the reason why this book fails. It covers so much from so many different scientific disciplines that I found myself either switching off, or feeling overwhelmed (that said, it did get more interesting as it went on and got further away from the 'hard' science). Having read books by Steven Pinker, Jonathan Haidt, Richard Dawkins, Jarod Diamond et al., I came across a lot of debates and ideas I already knew about, and although I respect Sapolsky as a scientist, I wasn't a fan of his writing style (I got so sick of 'scads of...' and 'stay tuned'!). I'm sure I've learnt lots of things from this book, but right after having finished it I couldn't really verbalise these to anyone.",,,1,,,0,,,,,
6296680,Understanding Psychology as a Science: An Introduction to Scientific and Statistical Inference,Zoltan Dienes,"Dienes, Zoltan",,023054231X,9.78E+12,4,4.2,Palgrave Macmillan,Paperback,150,2008,2008,07/04/2020,29/03/2020,"non-fiction, psychology",non-fiction (#95),read,"This is a very good 'further reading' or extension book for anyone with knowledge of basic statistics, and it's definitely relevant outside of Psychology. The book gets increasingly technical as it goes on, beginning with two chapters on the philosophy of science covering Popper, Kuhn, and Lakatos. These chapters are lucid and easy to understand. The book then goes on to set out three particular paradigms in statistical inference: the Neyman-Pearson method (which is what you were probably taught if you studied Psychology undergrad); Bayesian statistics, and finally likelihood inference. I learnt lots here despite my prior stats training. <br/><br/>I don't usually add textbooks to my read list but I did actually read all of this! I came across this book in Bodo Winter's 'Statistics for Linguistics' R textbook as recommended reading. ",,,1,,,0,,,,,
19234594,"Pietr the Latvian (Inspector Maigret, #1)",Georges Simenon,"Simenon, Georges",David Bellos,,,1,3.47,Penguin Books,Kindle Edition,176,2014,1931,05/04/2020,03/04/2020,fiction,fiction (#148),read,,,,1,,,0,,,,,
11205484,Tell No One,Harlan Coben,"Coben, Harlan",,,,3,4.11,,Kindle Edition,386,,2001,26/03/2020,21/03/2020,fiction,fiction (#146),read,,,,1,,,0,,,,,
41601079,The Silent Patient,Alex Michaelides,"Michaelides, Alex",,,,3,4.09,Orion,Kindle Edition,352,2019,2019,12/03/2020,08/03/2020,fiction,fiction (#145),read,"Easy to read, keeps your interest, big twist at the end. But I didn't rate the writing style and thought the characters were very 2D.",,,1,,,0,,,,,
102927,Never Let Me Go,Kazuo Ishiguro,"Ishiguro, Kazuo",,057122413X,9.78E+12,4,3.82,Faber and Faber,Paperback,282,2006,2005,08/03/2020,01/03/2020,fiction,fiction (#144),read,,,,1,,,0,,,,,
42937836,Babel: Around the World in Twenty Languages,Gaston Dorren,"Dorren, Gaston",,,,3,3.78,Atlantic Monthly Press,Kindle Edition,320,2018,2018,08/03/2020,23/02/2020,non-fiction,non-fiction (#93),read,"This book covers the 20 most widely-spoken languages in the world. The chapters are very inconsistent, flitting from overly-conversational to overly-technical; some focus on the sociology and history of a language, others on linguistic features.",,,1,,,0,,,,,
42733647,Blueprint: How DNA Makes Us Who We Are (The MIT Press),Robert Plomin,"Plomin, Robert",,,,2,4,The MIT Press,Kindle Edition,280,2018,2018,29/02/2020,17/02/2020,non-fiction,non-fiction (#94),read,"I didn't really enjoy this. Quite short, but also quite repetitive. It's all in the strapline: how DNA makes us who we are -the environment doesn't get a look in, and nothing on epigenetics. The second part discussed the forthcoming DNA revolution, but it's a lot of words to describe something that hasn't happened yet...",,,1,,,0,,,,,
7599372,A Single Man,Christopher Isherwood,"Isherwood, Christopher",,99541289,9.78E+12,4,4.1,Vintage Classics,Paperback,152,2010,1964,21/02/2020,12/02/2020,fiction,fiction (#143),read,,,,1,,,0,,,,,
6234210,Musicophilia: Tales of Music and the Brain,Oliver Sacks,"Sacks, Oliver",,,,4,3.92,Vintage,Kindle Edition,401,2008,2007,11/02/2020,22/01/2020,"non-fiction, psychology",non-fiction (#91),read,"A fascinating collection of case studies showing how the brain really does have a special place for music. This seems to be a mixture of patients which Sacks had already described in other places (e.g. An Anthropologist on Mars), and I can't help feeling that Musicophilia plays second fiddle to these. (Note that only 66% of this Kindle edition is actually the book - the rest is footnotes and bibliography).",,,1,,,0,,,,,
10847,Under the Banner of Heaven: A Story of Violent Faith,Jon Krakauer,"Krakauer, Jon",,330419129,9.78E+12,4,4.18,Pan MacMillan,Paperback,400,2004,2003,09/02/2020,26/01/2020,non-fiction,non-fiction (#90),read,"I really enjoyed this: a thorough and entertaining history of Mormonism and its fundamentalist schism. It juxtaposes two stories - the history of Joseph Smith and the Mormon exodus, and the brutal murder committed by the fundamentalist Lafferty brothers in 1984. What I found fascinating were the questions around the thin line between mental illness and religious fanaticism (brought out in the discussion of the Laffertys' court case), and the role of burgeoning documentary evidence in exposing the skulduggery perpetrated by followers of the religion.",,,1,,,0,,,,,
7117831,Blood Meridian,Cormac McCarthy,"McCarthy, Cormac",,330544586,9.78E+12,2,4.31,Picador,Paperback,355,2011,1985,27/01/2020,05/01/2020,fiction,fiction (#142),read,"It was a huge relief to have finished this. I sense that it's a good story, but in my opinion McCarthy makes it very hard for the reader. The whole thing felt like a dream in which you have a general sense of anxiety but aren't really sure why.",,,1,,,0,,,,,
37826561,Educated,Tara Westover,"Westover, Tara",,,,4,4.17,Cornerstone Digital,Kindle Edition,382,2018,2018,22/01/2020,11/01/2020,non-fiction,non-fiction (#89),read,A great memoir; the ultimate example of imposter syndrome!,,,1,,,0,,,,,
50890734,The Body: A Guide for Occupants,Bill Bryson,"Bryson, Bill",,857522418,9.78E+12,4,4,Doubleday,Paperback,464,2019,2019,02/01/2020,27/12/2019,non-fiction,non-fiction (#88),read,"Another wonderfully written non-fiction work from Bill Bryson. This book is incredibly wide-ranging (literally from birth to death), and I particularly enjoyed the stories around the various discoveries and inventions. For every fact that I had already come across, there were another 4 or 5 that I hadn't.",,,1,,,0,,,,,
17318929,Lady Audley's Secret,Mary Elizabeth Braddon,"Braddon, Mary Elizabeth",Esther Saxey,,,4,4.47,Wordsworth Editions Ltd,Paperback,400,1997,1862,27/12/2019,22/12/2019,fiction,fiction (#141),read,I really enjoyed this - a Victorian blockbuster! Can be read for the simple pleasure of the mystery-solving narrative or more deeply as a social commentary.,,,1,,,0,,,,,
928935,No Logo: Taking Aim at the Brand Bullies,Naomi Klein,"Klein, Naomi",,676972829,9.78E+12,3,3.76,Vintage Canada,Paperback,512,2000,2000,15/12/2019,23/11/2019,non-fiction,non-fiction (#86),read,"I'd heard No Logo being talked about in a few different places (i.e. as one of Radiohead's inspirations) so thought I'd give it a go. Obviously a lot has changed in the 20 years since it was published, although I'm sure modern brands are still engaging in military-grade skulduggery, just in different channels. This book was a bit of a slog for me - the writing is high quality, but there's a lot of it...",,,1,,,0,,,,,
5325066,The Road,Cormac McCarthy,"McCarthy, Cormac",,,,5,3.87,Vintage,Kindle Edition,324,2007,2006,11/12/2019,06/12/2019,fiction,fiction (#140),read,,,,1,,,0,,,,,
158380,"A Concise History of the Modern World, Fourth Edition: 1500 to the Present:  A Guide to World Affairs",William Woodruff,"Woodruff, William",,333971639,9.78E+12,4,3.65,Palgrave Macmillan,Paperback,400,2002,1991,29/11/2019,02/11/2019,"non-fiction, history",non-fiction (#87),read,"An authoritative crash course in modern world history. This is not a gentle, hand-holding, traipse through world events; readers would benefit greatly from at least some background knowledge. That said, you're always free to look things up along the way.",,,1,,,0,,,,,
52171488,Ayoade on Top,Richard Ayoade,"Ayoade, Richard",,,,4,3.89,Faber & Faber,Kindle Edition,193,2019,2019,20/11/2019,16/11/2019,non-fiction,non-fiction (#85),read,,,,1,,,0,,,,,
44801274,Doggerland,Ben   Smith,"Smith, Ben",,8313377,9.78E+12,1,3.97,Fourth Estate,Paperback,248,2019,2019,16/11/2019,10/11/2019,fiction,fiction (#139),read,"What a slog this was. It seemed pretty pointless as a story, if you could even call it that. All the way through it felt very difficult to visualise what was going on, and I didn't appreciate pages and pages being spent on really nothing happening at all.",,,1,,,0,,,,,
37380,The Heart Is a Lonely Hunter,Carson McCullers,"McCullers, Carson",,618084746,9.78E+12,4,3.98,Mariner Books,Paperback,359,2000,1940,09/11/2019,30/10/2019,fiction,,read,"This was a slow burner. Not much happens, but it's an interesting character study.",,,1,,,0,,,,,
11383192,When the Lion Feeds,Wilbur Smith,"Smith, Wilbur",,,,3,3.76,,Kindle Edition,544,,1964,25/10/2019,13/10/2019,fiction,fiction (#138),read,"This story could accurately be described as 'epic' - a sort of bildungsroman that takes place in late 19th century South Africa. It crams a lot of events into its pages including the Anglo-Zulu war and the gold rush. I think if you politely excuse the fact that this was written in 1964, and don't dwell too much on the - at times stilted - writing style, then there is a great story to be enjoyed here. It does end rather abruptly and depressingly, but then I suppose that's forgivable in a series of 18 books!",,,1,,,0,,,,,
37062611,A Short History of South Africa,Gail Nattrass,"Nattrass, Gail",,,,3,3.78,Biteback Publishing,Kindle Edition,304,2017,2017,12/10/2019,05/10/2019,"non-fiction, history",non-fiction (#84),read,"This is definitely a good overview text which clearly makes an effort to include the stories and perspectives of those traditionally neglected by history books. However I don't think the writing style is the best, and it could have done with some photographs of the events/people covered.",,,1,,,0,,,,,
6251564,"Murder on the Orient Express (Hercule Poirot, #10)",Agatha Christie,"Christie, Agatha",,,,4,4.08,William Morrow Paperbacks,Kindle Edition,256,2003,1934,05/10/2019,02/10/2019,fiction,fiction (#137),read,"Definitely a product of its time (1930s), but a classic murder-mystery story that genuinely kept my interest.",,,1,,,0,,,,,
39968298,Why We Get the Wrong Politicians,Isabel Hardman,"Hardman, Isabel",,,,3,4.17,Atlantic Books,Kindle Edition,336,2018,2018,01/10/2019,21/09/2019,non-fiction,non-fiction (#83),read,"Hmm, slightly misleading title. Should be more like ""What it's Like to Be a Politician in Britain"". This book is very much focused on how things are rather than on how things could be. I found it a bit long and dry at times, but the background research has clearly been done, and there are numerous quotes throughout.",,,1,,,0,,,,,
44413406,This is Your Brain on Music: Understanding a Human Obsession,Daniel J. Levitin,"Levitin, Daniel J.",,241987350,9.78E+12,2,3.44,Penguin,Paperback,314,2019,2006,20/09/2019,03/09/2019,"non-fiction, psychology",non-fiction (#80),read,"I wouldn't recommend this book: it was a slog to finish. I guess the audience is 'people who know nothing about music' and 'people who nothing about psychology', neither of which I fit into. The first two chapters are dedicated to music theory, which seemed gratuitous, and the rest of the book is bloated with uninteresting or not particularly relevant personal anecdotes. Perhaps it's because this is an under-researched field, but I felt this book was quite light on the actual science.",,,1,,,0,,,,,
578522,Black Dogs,Ian McEwan,"McEwan, Ian",,99277085,9.78E+12,2,3.81,Vintage,Paperback,174,1998,1992,19/09/2019,11/09/2019,fiction,fiction (#135),read,The only McEwan novel I've read that I haven't enjoyed. This one felt quite disparate and just didn't really come together for me.,,,1,,,0,,,,,
18841994,A Dark-Adapted Eye,Barbara Vine,"Vine, Barbara",,,9.78E+12,3,3.87,Penguin,Kindle Edition,304,2009,1986,04/09/2019,24/08/2019,fiction,fiction (#134),read,Definitely not an 'unputdownable' book. A very complicated family tree and drawn-out portrait of a dysfunctional sibling relationship which culminates in murder. ,,,1,,,0,,,,,
25930798,Joan of Arc,Helen Castor,"Castor, Helen",,571284639,9.78E+12,3,3.71,Faber  Faber,Paperback,352,2015,2014,23/08/2019,14/08/2019,"non-fiction, history",non-fiction (#79),read,"Superbly written and researched, but quite hard to get into at first. With any history book I find myself googling names and events along the way, but much more so with this book.",,,1,,,0,,,,,
866592,A Demon in My View,Ruth Rendell,"Rendell, Ruth",,375704914,9.78E+12,3,3.97,Vintage Crime/Black Lizard,Paperback,192,2000,1976,18/08/2019,15/08/2019,fiction,fiction (#133),read,"My first Ruth Rendell. 3.5/5 for this one. Great writing and storytelling, but a very abrupt ending.",,,1,,,0,,,,,
36066197,Unnatural Causes,Richard  Shepherd,"Shepherd, Richard",,,,5,3.82,Penguin,Kindle Edition,395,2018,2018,10/08/2019,29/07/2019,non-fiction,non-fiction (#78),read,A very unusual but very interesting memoir of a forensic pathologist. ,,,1,,,0,,,,,
534819,The Birth of Venus,Sarah Dunant,"Dunant, Sarah",,1844080358,9.78E+12,2,3.76,Virago Press,Paperback,422,2004,2003,05/08/2019,29/07/2019,fiction,fiction (#136),read,,,,1,,,0,,,,,
