Book Id,Title,Author,Author l-f,Additional Authors,ISBN,ISBN13,My Rating,Average Rating,Publisher,Binding,Number of Pages,Year Published,Original Publication Year,Date Read,Date Added,Bookshelves,Bookshelves with positions,Exclusive Shelf,My Review,Spoiler,Private Notes,Read Count,Recommended For,Recommended By,Owned Copies,Original Purchase Date,Original Purchase Location,Condition,Condition Description,BCID
57249292,Burn: The Misunderstood Science of Metabolism,Herman Pontzer,"Pontzer, Herman",,,,4,4.14,Penguin,Kindle Edition,374,2021,2021,01/11/2024,08/10/2024,non-fiction,non-fiction (#192),read,"This book is about newly emerging insights into human metabolism, and particularly the idea of 'constrained daily energy expenditure'. The take-home message is that the human body has evolved to expend roughly the same number of calories per day pretty much regardless of the level of physical activity (contrary to the old view that more activity resulted in more calories being burned). This has some important implications, for instance, it explains why exercise is ineffective for losing weight (dieting is better as it controls the energy INPUT). It also reframes the situation as one of trade-offs:  if a body has a constant rate of energy expenditure, then introducing more physical activity means it has to expend less energy on other things. For instance, exercise reduces the inflammation response because the body has to divert its energy resources to muscles and other functions, reducing energy spent on unnecessary immune system activity. <br/><br/>Pontzer's writing is engaging and he regales the reader with stories of his time living among the Hadza hunter-gatherer tribe. The book also provides a crash course in evolution, paleoanthropology, diet science, and even dips into climate change at the end. ",,,1,0,,,,,,,
61401116,The Satsuma Complex,Bob Mortimer,"Mortimer, Bob",,1398521213,9781398521216,3,3.68,Gallery,Kindle Edition,301,2022,2022,19/10/2024,06/10/2024,fiction,fiction (#254),read,,,,1,0,,,,,,,
31681718,Conquerors: How Portugal Forged the First Global Empire,Roger Crowley,"Crowley, Roger",,0571290906,9780571290901,4,4.27,Faber & Faber,Paperback,412,2016,2015,03/10/2024,23/09/2024,"non-fiction, history","non-fiction (#190), history (#38)",read,"I really enjoyed the first half of this book - descriptions of the voyages of Bartolomeu Dias in finding a navigable route to the African Cape, and Vasco da Gama in reaching India's Malabar coast. The book gives good background on the justifications for wanting to reach India (i.e. to trade, spread Christianity, and seek out Prester John in Ethiopia), and it was interesting how the various voyages built upon each other, with Portuguese navigators getting further with each one. I found the second half of the book more slow going, with the various escapades of Almeida and Albuquerque, describing battle after battle in too much detail. That said, Crowley does give a good picture of the personalities of the major players at the time. It also would have been good to have more from the perspective of the African, Indian, Arabian, and Indonesian peoples who were forced to suffer the onslaught of Portuguese imperialism.",,,1,0,,,,,,,
832852,The Motorcycle Diaries,Ernesto Che Guevara,"Guevara, Ernesto Che",,0007172338,9780007172337,3,3.79,Harper Perennial,Paperback,166,2004,1992,01/10/2024,18/09/2024,non-fiction,non-fiction (#191),read,"A retelling of the months-long trek across South America by Che Guevara and his friend Alberto Granado in the early 1950s. This has snippets of interesting insights and poetic prose, but is mainly filled with the bravado, privations, and close shaves of the young men's journey from Argentina to Venezuela. 'Motorcycle diaries' is a bit of a misnomer as their bike conks out fairly early on!",,,1,0,,,,,,,
52387141,The Underground Railroad,Colson Whitehead,"Whitehead, Colson",,708898408,9.78071E+12,3,4.06,Fleet,Paperback,366,2017,2016,17/09/2024,02/09/2024,fiction,fiction (#253),read,"Cora is a slave who escapes from her plantation in Georgia and is pursued across America by a slave catcher called Ridgeway. <br/><br/>Ostensibly this was a good story - a classic protagonist vs antagonist tale - but it wasn't an enjoyable read at all. Whitehead seems to make it difficult for the reader to keep track, and I was so glad when I found a summary on Sparknotes. The writing had a sort of detached, mythical nature, new chapters would begin without any explanation or context, lots of new characters seemed to be introduced at once, and I didn't understand a number of the references/specific vocabulary used. I also agree with other reviews which say that it lacked emotional punch (despite some of the horrific scenes described and alluded to). ",,,1,0,,,,,,,
38213085,Mythos: The Greek Myths Retold,Stephen Fry,"Fry, Stephen",,1405934131,9.78141E+12,3,4.26,Penguin Books,Paperback,459,2018,2017,16/09/2024,30/08/2024,non-fiction,non-fiction (#189),read,"References to Greek mythology are always popping up, so I thought this would be a good introduction. Stephen Fry's erudition, wit, and humour certainly enhance this text, but still found it a bit of a slog. <br/><br/>The book is punctuated by lots of short stories retelling the various Greek myths, but there were so many names and references that it got a bit overwhelming at times. Example: ""Amongst the many daughters of the Oceanid Doris and the sea god Nereus, was one Nereid called Galatea. ...she was adored by Polyphemus, a Cyclops. ...Polyphemus was the savage and ugly offspring of Poseidon and the Oceanid Thoosa.""<br/><br/>I did get a better idea of the origin story though, i.e. how it started with the first order, Gaia and Ouranos, followed by Kronos and his children, then the Titanomachy, Zeus and Olympus, etc. ",,,1,0,,,,,,,
61403399,The Odyssey,Lara Williams,"Williams, Lara",,024199165X,9.78024E+12,4,3.09,Penguin,Paperback,208,2023,2022,30/08/2024,24/08/2024,fiction,fiction (#252),read,"Ingrid fritters away her days as an employee on a super cruiseliner, cycling from one job rotation to the next. The story is about the gradual uncovering of her past trauma (explaining her increasingly debauched behaviour whenever she gets Land Leave) as well as her relationship with the ship's captain Keith as she wins a place on his esoteric self-development 'programme'. Keith is a cult-like figure, obsessed with the Japanese philosophy of wabi sabi, and demands bizarre sacrifices from Ingrid as well as the rest of his staff. <br/><br/>The Odyssey definitely has similarities with the writing of Ottessa Moshfegh (debauchery, dysfunction, a female protagonist with a 'messy' life). The description of life on the ship was also quite Orwellian or Kafkaesque, and I think the book makes a statement about the vapidness and anomie-inducing nature of modern work culture (fitting in nicely with the wabi sabi ideas of ""transience and decay""). <br/><br/>I'm not sure if I understood the ending (or Ingrid's relationship with Keith for that matter), but this isn't the kind of book you read for a typical linear narrative.",,,1,0,,,,,,,
45989570,The Nordic Theory of Everything: In Search of a Better Life,Anu  Partanen,"Partanen, Anu",,,,3,3.86,Duckworth,Paperback,419,2018,2016,29/08/2024,16/08/2024,non-fiction,non-fiction (#188),read,"Finnish-born journalist Anu Partanen compares the lives of Finns and Americans across the areas of education, health, work, social security, and business. The idea underpinning the book is the ‘Nordic theory of love’. Contrary to misplaced notions that Nordic countries are socialist, this is a philosophy in which individuals are supported by the state so as not to be dependent on it or the other people around them; in other words, these countries bake in liberty from the moment their citizens are born by allowing their parents time off and equipping them with free education and healthcare. <br/><br/>The problem with comparing the USA to anywhere else is that it is an outlier to begin with. So of course the book tends to take the format of “look how bad life is in the USA… but look how much better it is in Scandinavia” (though Partanen does acknowledge that Nordic countries are far from perfect, and that the American outlook can have its advantages). <br/><br/>I was most interested in the section on education, for instance: how Finland reformed its education in the 1970s in anticipation of a knowledge economy; how it takes a supply- rather than demand-side approach to education (it’s a basic human right, not a good driven by demand); and how Finnish teachers are so well respected because of the sheer amount of training they have to undertake (700 hours of classroom practice during a master’s program). There were also interesting references to Beatrice Webb and the role of her idea of a “national minimum of civilised life” in founding Britain’s welfare state. <br/><br/>Altogether though, the book probably should have been cut by at least a third as it’s rather repetitive. There was also too much focus on America – this was necessary due to the comparison, but I felt like I finished the book wanting more insight into Nordic society and culture, not the societal ills of the USA (with which I’m already sadly well-acquainted). ",,,1,0,,,,,,,
9529,"The Shadow of the Wind (The Cemetery of Forgotten Books, #1)",Carlos Ruiz Zafon,"Zafón, Carlos Ruiz",Lucia Graves,,,3,4.3,Phoenix Press,Paperback,520,2005,2001,16/08/2024,31/07/2024,fiction,fiction (#251),read,"This is the story of Daniel Sempere, a boy in mid-20th century Barcelona who unravels the life of the mysterious writer Julian Carax. I certainly didn't love this book but the gradual unveiling of the central mystery kept me interested enough to finish it. For me, the story was very complex and had so many different characters - if I put it down for a day or two I had to retrace my steps to remember what on earth was going on. The book is translated, but even so, the prose felt quite flat and I wasn't a fan of the dreamlike, pseudo-profound storytelling style. ",,,1,0,,,,,,,
6328162,On Photography,Susan Sontag,"Sontag, Susan",,141035781,9.78E+12,3,3.89,Penguin Books,Paperback,207,2010,1973,15/08/2024,05/07/2024,non-fiction,non-fiction (#185),read,"<i>On Photography</i> offers some interesting nuggets of insight into the meaning and practice of photography... IF you are prepared to wade through the over-written and abstruse writing style. <br/><br/>Some points I took away: photographs are as much an interpretation of the world as paintings are, and exciting photos say something in a new manner; photography is an act of non-intervention - the photographer is a ‘supertourist’ or anthropologist who does not intervene in people’s lives but briefly visits them; how the advent of photography liberated painters from accurately describing reality, allowing them to focus on abstraction; photography is not a form of art all, but a medium through which art can be produced; the historical tendency towards black and white photography is because it was seen as more decorous than colour, or less sentimental and crudely lifelike (Cartier-Bresson renounced colour in his work). ",,,1,0,,,,,,,
31877836,Photography Masterclass Creative Techniques of 100 Great Photographers,Paul Lowe,"Lowe, Paul",,050054462X,9.78E+12,4,4.29,Thames & Hudson,Paperback,288,2016,2016,09/08/2024,17/07/2024,non-fiction,non-fiction (#187),read,"This was an interesting canter through 100 photographic 'masterpieces' split across 10 categories (e.g. places, things, ideas, stories, documents). Each section is chronological, containing images from the 1800s through to the early 2000s.<br/><br/>The book definitely improved my knowledge of notable photographers and also gave good insight into their thought processes. There were a few themes that came through for me. One is the idea that good photography involves the ""art of observation"" and ""finding something interesting in an ordinary place"" (Elliott Erwitt). It's about how you frame the world around you in a way that conveys a deeper meaning. Another theme was how gear is only a means to an end - that end being the ability to tell a great story. Also on this theme, the idea that photographers should know their equipment inside out and push it to its limits. <br/><br/>Some stand out bits for me included: Francis Frith and how he sold his grocery business to fund his travels around the world to take photos; how early photographers battled impressively against heavy equipment and the wet collodion process; John Davies' images of post-industrial Britain; Tony Ray-Jones' philosophy of taking photos of events that take longer to read than they do to happen; how Dougie Wallace uses flash to 'provoke' a situation and work with his street subjects rather than melt into the background; and finally Erich Salomon and the lengths he went to to sneak his camera into high society events, concealing his lens in a bowler hat or bagpipes!",,,1,0,,,,,,,
40169377,Posh Boys,Robert Verkaik,"Verkaik, Robert",,1786073838,9.78E+12,2,3.85,Oneworld ,Hardcover,400,2018,2018,26/07/2024,12/07/2024,non-fiction,non-fiction (#186),read,"If you’re looking for a good read on the social iniquities of the private school system, this book isn’t it. <br/><br/>I read this because it was referenced in [b:Engines of Privilege: Britain's Private School Problem|40872550|Engines of Privilege  Britain's Private School Problem|David Kynaston|https://i.gr-assets.com/images/S/compressed.photo.goodreads.com/books/1541330107l/40872550._SY75_.jpg|63679359] as an interesting, more journalistic take on the issue. Unfortunately I just found Posh Boys too unfocused and repetitive. <br/><br/>The book is split in two: part one deals with the history of private schools from the medieval period onwards and annoyingly seems to have a particular focus on military figures (Verkaik has written on this topic previously). <br/><br/>Part two takes us into the modern era (up to 2017) but just seems to be an opportunity for the author to have his take on the events and characters of the day. We get mini biographies of figures like David Cameron, Nigel Farage, and Jeremy Corbyn, and discussion of Brexit, Cambridge Analytica, and the coalition government. The link with private schools is basically “all these terrible people went to private schools and therefore put personal ambition before national interest”. <br/><br/>There were some interesting insights: for instance how private school alumni can sign up for membership lists, giving them contact details for whenever they need advice or a handy internship; and Verkaik quotes the beginning of an article by Andy Beckett who writes humorously <a href=""https://www.theguardian.com/education/2017/feb/23/ppe-oxford-university-degree-that-rules-britain"">in the Guardian</a> about the scourge of the Oxford PPE degree.",,,1,0,,,,,,,
38471774,Key Moments in Art,Lee Cheshire,"Cheshire, Lee",,500293627,9.78E+12,4,4.12,Thames & Hudson,Paperback,176,2018,2019,10/07/2024,03/07/2024,non-fiction,non-fiction (#183),read,,,,1,0,,,,,,,
43239854,Engines of Privilege: Britain's Private School Problem,David Kynaston,"Kynaston, David",Francis Green,1526601249,9.78E+12,4,3.63,Bloomsbury Publishing,Kindle Edition,385,2019,2019,04/07/2024,20/06/2024,non-fiction,non-fiction (#184),read,"7% of children in the UK are educated at one of 2,500 private (‘public’ / ‘independent’) schools, where they benefit from approximately three times the level of resources available to their state-educated counterparts. This is ostensibly a service industry which creates an ‘educational apartheid’, ‘cements elite structures’, and is fundamentally ‘incompatible with the pursuit of a fairer, more cohesive society’. <br/><br/>This is the damning indictment of private schooling by academics David Kynaston and Francis Green. Across 9 chapters, the book examines the potted history of private schools and the enduring inertia of political will to reform them, what their fees actually buy, why parents choose to send their children to them, and detailed options for reform. The authors discuss the effects of extra resources, small class sizes, peer effects, and autonomy on attainment, and often return to the issues of charitable status and proposals to levy VAT (a policy still espoused by the Labour party on the eve of the 2024 general election). <br/><br/>The authors wear their stripes proudly in arguing for the need for reform, and there are some incisive and interesting points made. For instance, it’s often argued that parents should have a right to buy a private education if they so wish – that’s true of certain consumer goods and services, yes, but education is different because it’s ‘formative’ and has huge effects on life chances. There is also criticism of the idea that we can’t abolish private schools because that would leave a gaping hole in the economy – not so, because this assumes a counterfactual in which those parents, students, and teachers all disappear into the ether rather than join – and pay tax through - the state sector. <br/><br/>There is also discussion of how schools choose to justify their charity status through partnerships with state institutions. This is really laughable in many cases, for instance staff serving as governors at state schools, hosting joint debating clubs and drama events, and sharing swimming pools. All they have to do for their tax breaks is to pay lip service to the very idea of ‘public benefit’. <br/><br/>One strength of this book is its detailed proposals for reform. It discusses ideas to reduce both the demand for and supply of private education through contextual admissions policies (a form of positive discrimination), raising fees through taxation, and Open / Fair Access Schemes. Ultimately, though it’s likely that no major reforms will take place – and is it any wonder when one considers that the alumni of the accused extend like tentacles into all the high and influential positions in society? <br/><br/>I would recommend this book to anyone interested in the position of private education in contemporary Britain. The writing quality does vary across the chapters - there's a degree of repetition and over-quoting throughout (and an obsession with em dashes!), but the arguments and evidence are interesting. ",,,1,0,,,,,,,
167731538,Yellowface,Rebecca F. Kuang,"Kuang, Rebecca F.",,8532788,9.78E+12,4,3.78,The Borough Press,Paperback,323,2023,2023,20/06/2024,12/06/2024,fiction,fiction (#250),read,"Modern, zeitgeisty litfic - I really enjoyed this. Juniper Hayward steals the manuscript of her recently-dead, much-more-successful frenemy Athena Liu and turns it into a bestseller. But it's not long before accusations swirl and the immortality of her actions start to catch up with her. This is a very modern story about the pressures of the publishing industry, social media, and isolation. At the heart of the book is the question of authentic authorship; or, who is allowed to write what. It's interesting that Kuang is of Chinese heritage yet chooses to write from the first-person perspective of a white woman writing about Chinese history. ",,,1,0,,,,,,,
416985,Peacemakers: Six Months that Changed the World,Margaret MacMillan,"MacMillan, Margaret",,719562376,9.78E+12,4,4.12,Hodder Hb,Paperback,574,2003,2001,11/06/2024,17/04/2024,"non-fiction, history","non-fiction (#181), history (#37)",read,"After reading [b:The Sleepwalkers: How Europe Went to War in 1914|18669169|The Sleepwalkers  How Europe Went to War in 1914|Christopher   Clark|https://i.gr-assets.com/images/S/compressed.photo.goodreads.com/books/1384804367l/18669169._SY75_.jpg|21905061], this seemed the logical next choice for understanding the political implications of the Great War. With great authority and detail, MacMillan takes the reader through the first six months of 1919 as the peacemakers (Wilson, Clemenceau, Lloyd George, and numerous national delegations) worked to hash out the Treaty of Versailles and various other peace deals. There is also a great deal of history and context discussed along the way.<br/><br/>Some of the key themes include: Wilson’s Fourteen Points and idea of self-determination as a guiding principle; the effect of Bolshevism and the desire for a ‘cordon sanitaire’ in Europe; France’s particular hatred towards Germany for having suffered the most; disagreements over reparations and the effect of these in the following decades; and the redrawing of maps and numerous conflicts of territorial claims (Italy and Yugoslavia, Germany and Poland, Japan and China, Greece and Turkey, the Sykes-Picot agreement for spheres of influence in the Middle East).<br/><br/>The only criticism I have is that I often finished a chapter feeling uncertain as to what the final outcome was – they wanted x, but the others wanted y… but what was the final result? There are a number of maps at the front of the book, but I didn’t find them totally clear.",,,1,0,,,,,,,
6336454,A Streetcar Named Desire,Tennessee Williams,"Williams, Tennessee",,141190272,9.78E+12,4,3.98,PENGUIN,Paperback,112,2009,1947,10/06/2024,06/06/2024,fiction,fiction (#249),read,"I decided to read this play because it seems to crop up quite often. Set in New Orleans, it's a story of desire, death, and madness swirling around three major characters: Stella, her husband Stanley, and her sister Blanche. There's so much tension, and what happens at the end is really shocking - both in terms of what happens to Blanche and Stella's reaction to it. ",,,1,0,,,,,,,
6554208,Van Gogh: His Life & Works in 500 Images,Michael   Howard,"Howard, Michael",,075481954X,9.78E+12,4,4.59,Lorenz Books,Hardcover,256,2010,2009,05/06/2024,28/05/2024,non-fiction,non-fiction (#182),read,"I thought this was a very good introduction to the life and works of Van Gogh. The first half covers his biography (the Lowlands and England, Arles, St-Remy, and Auvers), while the second half is a gallery dedicated just to his works. The whole book is replete with high quality colour images which, in the first part, also include some photographs and prints of other artists who served as Vincent's inspiration. ",,,1,0,,,,,,,
59454274,Still Life,Sarah Winman,"Winman, Sarah",,8283397,9.78E+12,2,4.17,HARPER COLLINS,Paperback,438,2022,2021,23/05/2024,04/05/2024,fiction,fiction (#248),read,"After the first 50-or-so pages of this book I really wanted to put it down but was persuaded (by someone!) to continue. So I settled in for another 400 pages of trying-too-hard-to-be-eccentric, too-cool-for-speechmarks prose. I just didn't buy the characters or events - I didn't feel any emotional connection to them and things just seemed to happen for the sake of it. I also thought the book smacked of ""I've been to Florence and I'm going to pepper every page with little Italian phrases and references to make it seem authentic"". ",,,1,0,,,,,,,
6270312,The Private Lives of the Impressionists,Sue Roe,Sue Roe,,99458349,9.78E+12,4,3.97,RANDOM HOUSE UK,Paperback,368,2007,2006,01/05/2024,07/04/2024,non-fiction,non-fiction (#180),read,"This book covers the artistic trials and tribulations of the French impressionist painters between the 1860s and 1890s. The original members (Monet, Pissarro, Cezanne, Renoir, Sisley) met initially at the painting schools of Suisse and Gleyre, where they all aspired to exhibit at the elite galleries of the Salon (Manet was always thought of as the leader but never actually exhibited with them). The book follows the development of the group and its new members (Caillebotte, Morisot, Cassatt, Gauguin, etc) through their 8 exhibitions, dealing with historical events (the Franco-Prussian war, Haussmann's renovation), personal relationships, money worries, and artistic experimentation along the way. <br/><br/>I learned a lot here, though sometimes the writing felt a little unfocused (how could it not be when you're dealing with the private lives of so many different individuals). The book does contain colour plates of some of the artworks described, but a wider selection would have been appreciated.",,,1,0,,,,,,,
62086891,Demon Copperhead,Barbara Kingsolver,"Kingsolver, Barbara",,571376487,9.78E+12,4,4.51,Faber & Faber,Paperback,546,2023,2022,10/04/2024,21/03/2024,fiction,fiction (#247),read,"A heart-wrenching modern adaptation of David Copperfield, the book follows the ordeals and privations of Demon Copperhead as he navigates poverty, the care system, and addiction in Appalachia. Kingsolver's writing is vivid and immersive, and although the story's foundation is provided by Dickens, this retelling is very modern and very American in flavour (e.g. football, opioids, various other references that went above my head!). We root for Demon as he attempts to surmount the awful cards he's been dealt in life - to do so, he has to show tenacity, bravery, and compassion. An excellent, if long, read.<br/><br/>(I read this for a book group at work).",,,1,0,,,,,,,
