Book Id,Title,Author,Author l-f,Additional Authors,ISBN,ISBN13,My Rating,Average Rating,Publisher,Binding,Number of Pages,Year Published,Original Publication Year,Date Read,Date Added,Bookshelves,Bookshelves with positions,Exclusive Shelf,My Review,Spoiler,Private Notes,Read Count,Recommended For,Recommended By,Owned Copies,Original Purchase Date,Original Purchase Location,Condition,Condition Description,BCID
52093195,A Moveable Feast,Ernest Hemingway,"Hemingway, Ernest",,99285045,9.78E+12,4,4.02,Vintage,Paperback,182,2020,1964,06/03/2022,27/02/2022,non-fiction,non-fiction (#139),read,"I enjoyed Hemingway's memoir way more than I enjoyed any of his books. In this short work he recounts his time in 1920s Paris among the 'lost generation', including Gertrude Stein, Ezra Pound, Sylvia Beach, and James Joyce. At that time, Hemingway was first starting out as a full-time writer and I liked his descriptions of working in various cafes and restaurants. The latter sections on F Scott Fitzgerald and his toxic relationship with Zelda were also entertaining. ",,,1,0,,,,,,,
292570,A Room of One's Own,Virginia Woolf,"Woolf, Virginia",,141018984,9.78E+12,3,4.21,Penguin UK,Mass Market Paperback,132,2005,1903,25/02/2022,21/02/2022,non-fiction,non-fiction (#138),read,"In order to write fiction, a woman needs a room of her own and a sufficient annual income. Over the course of 6 short chapters, Virginia Woolf justifies this conclusion by considering some of the societal, institutional, and economic factors holding women back from creating Great Art. She applies these to the imagined case of Shakespeare's sister; a woman of equal talent who, simply due to her sex and society's expectations, is thwarted artistically and whose life ends tragically, all in stark contrast to her brother Bill. I appreciated the points made in A Room of One's Own (many of which are no doubt still as relevant today as in 1929), but I'm not a fan of Woolf's typical meandering, distracted and at times incomprehensible style. ",,,1,0,,,,,,,
15923791,The Golden Notebook,Doris Lessing,"Lessing, Doris",,7498772,9.78E+12,3,3.77,HarperCollins,Paperback,576,2013,1962,23/02/2022,29/01/2022,fiction,fiction (#201),read,"The Golden Notebook is like a roiling ocean with islands of lucidity and insight. The 'story' is is about Anna Wulf, a single mother and one-time successful writer living in London who has a past in the Communist Party. Key themes are the (changing) role of women in society and the idea of disintegration (political and mental). The book is chopped up and moves between a free-standing novel ('Free Women'), and a series of Anna's notebooks which deal with different topics like politics, Anna's time in Africa, her thoughts on being a writer etc (the final, Golden Notebook supposedly ties these all together, but I didn't get that impression). I think the book is a product of its time and needs to be interpreted within the context of 1950s/60s second-wave feminism and the post-WWII threat of nuclear war. It's a very messy novel, not only in terms of its structure, but in its content - numerous affairs, a drawn-out mental breakdown, a suicide attempt, a stepmother eloping with her stepson, and the bizarre relationship at the end between Anna and Saul. It was certainly a difficult read, with its stodgy prose and lack of chapters/line breaks!",,,1,0,,,,,,,
633927,Agincourt: Henry V and the Battle that Made England,Juliet Barker,"Barker, Juliet",,316015040,9.78E+12,4,4.13,Back Bay Books,Paperback,445,2007,2005,05/02/2022,26/01/2022,"non-fiction, history","history (#26), non-fiction (#137)",read,"This was great - it's about so much more than the battle itself, including the political context, medieval life, and most importantly a portrait of Henry V himself. Juliet Barker is a great storyteller, though at the same time she gives a balanced account according to the different sources available. ",,,1,0,,,,,,,
56293415,Once There Were Wolves,Charlotte McConaghy,"McConaghy, Charlotte",,,,4,4.11,Flatiron Books,Kindle Edition,265,2021,2021,27/01/2022,22/01/2022,fiction,fiction (#200),read,"The story of two Australian sisters, Inti and Aggie, who move to Scotland to work on a project rewilding wolves into the highlands. Of course they have a traumatic past etc which works its way into the story through flashbacks, and the protagonist Inti is interesting due to her condition (mirror-touch synaesthesia). But I found the rewilding aspect of the book most interesting - the deleterious effects of eliminating apex predators ('trophic cascades') and friction between conservationists and farmers. For me, Aggie's actions towards the end were a bit off, and I don't think the ending gelled very well. But overall, a pretty good read. ",,,1,0,,,,,,,
51710349,The WEIRDest People in the World: How the West Became Psychologically Peculiar and Particularly Prosperous,Joseph Henrich,"Henrich, Joseph",,,,4,4.13,"Farrar, Straus and Giroux",Kindle Edition,706,2020,2020,22/01/2022,08/01/2022,"non-fiction, psychology","psychology (#34), non-fiction (#136)",read,"This was a difficult read at times, but I'm glad I persevered with it. Henrich uses a cultural psychology lens to pick up where Jared Diamond left off in Guns, Germs, and Steel (and in so doing offers better explanations for things like the Industrial Revolution and global variation in psychology today). <br/><br/>The book's main thesis is that societies used to be heavily kin-based (polygamy, cousin marriage) but this was curtailed by the Catholic church in the middle ages which banned such practices. Henrich explains: ""when relational bonds are fewer and weaker, individuals need to forge mutually beneficial relationships, often with strangers. To accomplish this, they must distinguish themselves from the crowd by cultivating their own distinct set of attributes, achievements, and dispositions"". As Europens became more individualistic and prosocial towards strangers, they established voluntary organisations, universal laws, the scientific method, etc. Protestantism really catalysed this underlying psychology, which helped to spark literacy and a particular work ethic. <br/><br/>The first part of the book was quite drawn out and full of jargon, but it gets more interesting after that as the reader starts to appreciate how each part of the puzzle fits together.",,,1,0,,,,,,,
632007,"Tournaments: Jousts, Chivalry and Pageants in the Middle Ages",Richard Barber,"Barber, Richard",Juliet Barker,851154700,9.78E+12,1,3.98,Boydell Press,Hardcover,225,1989,1978,21/01/2022,05/01/2022,"non-fiction, history","history (#25), non-fiction (#135)",read,"One of the most boring books I've ever read. Way too long, way too detailed, way too repetitive. No narrative structure, just a succession of points: this person did this thing in this year in this place. Then this thing happened in this year in this place.",,,1,0,,,,,,,
52199285,"Science Fictions: The Epidemic of Fraud, Bias, Negligence and Hype in Science",Stuart Ritchie,"Ritchie, Stuart",,1847925669,9.78E+12,4,4.38,Bodley Head,Paperback,368,2020,2020,05/01/2022,01/01/2022,"non-fiction, psychology","non-fiction (#134), psychology (#33)",read,"A very well written and timely critique of modern scientific research. Ritchie examines the problematic nature of research, ranging from unintentional foibles to downright fraud, as well as the perverse incentives which encourage p-hacking, salami-slicing, and file-drawering. I like how the book considers these issues in light of the four Mertonian norms of science (universalism, communalism, disinterestedness, and organised scepticism). ",,,1,0,,,,,,,
55555977,Oliver Twist,Charles Dickens,"Dickens, Charles","Ella Westland, George Cruikshank",,,4,3.88,Wordsworth Editions,Paperback,373,2000,1838,31/12/2021,23/12/2021,fiction,fiction (#199),read,"Probably 3.5. Dickens' first 'proper novel' is the story of an orphan boy brought up in a workhouse. Only, it isn't really a story ABOUT Oliver, but rather the tug-of-war between the characters surrounding him. On the one hand, Oliver is exploited by Mr Bumble, Mrs Sowerberry, and Fagin, while on the other hand, he is protected by Mr Brownlow and Mrs Maylie who ultimately see the story through to its happy conclusion. I think nature/nurture is a key theme in this book, which is illustrated through the contrast of Nancy and Rose, both orphans but with very different life experiences. ",,,1,0,,,,,,,
961093,The Quarry,Damon Galgut,"Galgut, Damon",,1843542951,9.78E+12,2,3.32,Atlantic Books,Paperback,176,2005,1995,20/12/2021,19/12/2021,"fiction, south-africa","fiction (#198), south-africa (#10)",read,"Not a fan of this one. It reminded me of Blood Meridian but also The Stranger because it was oddly anhedonic and written in a stilted/staccato fashion (Then this happened. Then that happened). The first half of the book was fine, but then everything gets a bit weird after that and Galgut tries to be arty by doing away with punctuation and writing extremely short chapters. This quote sums up the book really: ""It felt that his whole life had been expended in motion, had consisted of no substance but flight..."" That's all the book is - characters who are constantly on the move, escaping, being hunted, just moving for the sake of it... no background, no reason for the reader to care about them.",,,1,0,,,,,,,
17187000,Fingersmith,Sarah Waters,"Waters, Sarah",,1860498833,9.78E+12,4,4.02,Virago,Paperback,548,2012,2002,18/12/2021,02/12/2021,fiction,fiction (#197),read,"A complex Victorian-era story about double crossings, mental asylums, and love - what's not to love?! This was an excellent story, though at times I wished the story would have progressed a little faster.",,,1,0,,,,,,,
54633172,The Promise,Damon Galgut,"Galgut, Damon",,1784744069,9.78E+12,4,3.87,Chatto & Windus,Hardcover,293,2021,2021,29/11/2021,23/11/2021,"fiction, south-africa","fiction (#196), south-africa (#9)",read,"This was a good read. It follows the demise of a white South African family across four chapters and four funerals set roughly a decade apart. Aside from the social commentary and allegory, I found the characterisation excellent and enjoyed the somewhat unorthodox voice of the narrator.",,,1,0,,,,,,,
41086837,Milkman,Anna Burns,"Burns, Anna",,,,3,3.54,Faber & Faber,Paperback,352,2018,2018,21/11/2021,03/11/2021,fiction,fiction (#195),read,"Based on a young woman's perspective during the troubles in Northern Ireland, Milkman is written in a kind of stream-of-consciousness, tangent-hopping haze which makes for difficult reading. There were two points at which I nearly abandoned the book, but it does have pockets of lucidity. At times it was quite evocative; at other times I found myself thinking ""what the hell are you going on about??"" It was quite atmospheric, and made me think of the Reign of Terror during the French Revolution - ""it was constant hints, symbolisms, representations, metaphors"". The characters live in a fug of paranoia, gossip, and the constant threat of denunciation and violence.",,,1,0,,,,,,,
48641081,Superstition and Science,Derek Wilson,"Wilson, Derek",,147213592X,9.78E+12,2,3.42,Robinson,Paperback,320,2017,2017,20/11/2021,06/11/2021,"non-fiction, history","non-fiction (#133), history (#24)",read,"So glad I finally finished this... it reads a bit like A Little History of Science (William Bynum) in that it contains little biographies of famous thinkers, but it's written more like a dissertation. I battled with it particularly in the first few chapters and although it got a little more interesting later on, it certainly wasn't a pleasure to read. I wanted more of the big-picture, i.e. what were the events that led to the flourishing of empirical investigation and science. Instead, I got overly-detailed chapters that were siloed from one another. ",,,1,0,,,,,,,
17318942,The Tenant of Wildfell Hall,Anne Brontë,"Brontë, Anne",,,,4,4.01,Wordsworth Editions Ltd,Paperback,383,2013,1848,31/10/2021,18/10/2021,fiction,fiction (#194),read,"I enjoyed this, my first Acton Bell novel. A story of toxic masculinity and a woman's suffociating position in Victorian society. Arthur Huntingdon is clearly a colossal prick, but Helen isn't totally blameless because she entered into the marriage fully cognisant of his reputation, thinking she could change him (though to be fair, her alternatives weren't much better). ",,,1,0,,,,,,,
41864518,Revenge of the She-Punks: A Feminist Music History from Poly Styrene to Pussy Riot,Vivien Goldman,"Goldman, Vivien",,147731654X,9.78E+12,2,3.78,University of Texas Press,Paperback,216,2019,2019,23/10/2021,08/10/2021,non-fiction,,read,"I didn't enjoy this. It felt like an overwritten, thinly-veiled panegyric of the author's own life and all the famous people she knows. It was fun to follow up on some of the artists mentioned in the book, but I didn't get a strong sense of narrative and I don't feel like I learned much about the punk movement, though it got slightly better towards the end.",,,1,0,,,,,,,
11059934,A Fine Balance,Rohinton Mistry,"Mistry, Rohinton",,571248241,,4,4.37,Faber & Faber,Kindle Edition,624,2008,1995,16/10/2021,18/09/2021,fiction,fiction (#193),read,"Set in India's 'Emergency' in 1975, this book weaves a thread between a number of characters whose lives intersect and end up forming a strong familial bond despite the odds. The book deals with many social themes, including male vs female roles, rural vs urban life, traditional vs modern values, and social status and the caste system. Overall, this was a good read and the writing was excellent. I liked how it delved into the backgrounds of the different characters, but some of the events that took place felt farfetched and at times it felt like the book was trying too hard to pull on readers' heartstrings. I also didn't really understand Maneck's character and his actions in the epilogue. ",,,1,0,,,,,,,
54746562,Work:  A History of How we spend our Time,James Suzman,"Suzman, James",,1526605007,9.78E+12,3,3.85,Bloomsbury Circus,Kindle Edition,464,2020,2020,26/09/2021,10/09/2021,"non-fiction, history","history (#23), non-fiction (#132)",read,"I didn't really enjoy this, perhaps because there was too much overlap with books like Sapiens and Guns, Germs and Steel. The author takes a long time to make his point, and I thought large parts of the book were unnecessary and didn't seem to relate to the question at hand (it felt like 'look how much I know about the various revolutions Homo Sapiens has been through' rather than being to the point). I bumped it up from 2 to 3 stars after looking at my Kindle highlights though because there were some interesting insights. <br/><br/>It's essentially a economics book trying to trash the 'economic problem' which says that we work because our desires are infinite but our means are limited (no, Suzman argues, there's evidence of humans doing work when it wasn't necessary). I think the book spent too much time on prehistory (and even discusses the second law of thermodynamics). <br/><br/>It's broadly chronological: cooking food gave us free time and represented the start of culture (transforming things). Even hunter-gatherers had free time, and this helped language to develop. Then early climate change created food scarcity, prompting people to start producing (farming) food. This led to surplus, writing, and specialisation of jobs but also bad things like pestilence and overpopulation. With the increasing efficiency of the Industrial Revolution (Taylorism), people felt more detached than ever from their work (Durkheim's 'anomie'). This efficiency also served to reduce working hours, but because of consumerism, people continued to work to afford the things they wanted to purchase. The rise of the third sector and 'bullshit jobs' in recent times shows how we continue to work hard because it gives us a sense of community and belonging. <br/><br/>The latter parts of the book were definitely the most interesting. Of course, a book on a huge topic like 'work' can never be exhaustive, but I'd have liked more content on the psychology of work and deeper probing into the notion that work gives us a sense of belonging and identity. ",,,1,0,,,,,,,
56342480,The Book of Not,Tsitsi Dangarembga,"Dangarembga, Tsitsi",,,,3,3.64,Faber & Faber,Kindle Edition,313,2021,2006,10/09/2021,28/08/2021,fiction,fiction (#192),read,"I didn't particularly enjoy this second instalment in the Nervous Conditions trilogy. From the very first chapter I found it confusing and jumbled, especially with respect to the war. The writing style is stuffier and more old-fashioned than in the first book (I also thought there was something quite Brontean about the writing and the story). Some things just didn't gel for me, for instance how Tambu studied so hard but achieved such poor grades, and the final part about her job as a copywriter, which felt tacked on. I won't be reading the third book.",,,1,0,,,,,,,
830280,Southern African Wildlife: A Visitor's Guide,Mike Unwin,"Unwin, Mike",,1841620602,9.78E+12,4,4.2,Bradt Pubns,Paperback,256,2003,2003,28/08/2021,17/08/2021,non-fiction,non-fiction (#131),read,"Excellent guide, extremely well written and interesting.",,,1,0,,,,,,,
27134278,How Long Will South Africa Survive?: The Looming Crisis,R.W. Johnson,"Johnson, R.W.",,1849045593,9.78E+12,2,4.04,Hurst,Hardcover,288,2015,2015,27/08/2021,31/07/2021,non-fiction,non-fiction (#130),read,"OMG what a slog! I read this because it's cited in Gail Nattrass' A Short History of South Africa (2019). It was originally published in 1977 under the same title, so this is a major update. Johnson's major contention is that ""South Africa can either choose to have an ANC government or a modern industrial economy"", but not both. It's essentially a catalogue of fatal errors by the ANC party (corruption, mismanagement, etc) since Mandela up until 2015. It also gives insight into Zuma's presidency, exploring how his Zulu heritage effectively created a system of 'chiefly patronage' rather than a typical Western-style democracy. Of course, since the book's publication Zuma has been ousted (with over 300 deaths in the eventual fallout), running contemporaneously with Covid. No regime change just yet, but I think this will just strengthen Johnson's case that 'things have to go to get worse before they get better'. I haven't lived in SA since 2001 so of course this was going to be challenging, but Johnson makes it even harder with his writing, liberally peppering his dry lists of facts with names and references. Not a fun read, but I did learn some things (from the bits I didn't skip, anyway).",,,1,0,,,,,,,
36690518,Utopia For Realists,Bregman  Rutger,"Rutger, Bregman",,1408893215,9.78E+12,3,4.22,BLOOMSBURY,Paperback,316,2018,2014,26/08/2021,21/08/2021,non-fiction,non-fiction (#129),read,"I think I'm being generous in giving this 3 stars (only for its easy-to-read style and pockets of interestingness). Bregman champions three 'utopian' policies: universal basic income, a 15-hour workweek, and migration. These are massive topics and are only really skimmed over (UBI got the most attention, migration hardly any). The book just felt disorganised and rambly to me and I think it lacked a schema or lens to bring these things together. ",,,1,0,,,,,,,
1357693,About Grace,Anthony Doerr,"Doerr, Anthony",,000714699X,9.78E+12,4,3.45,HarperPerennial,Paperback,402,2005,2004,21/08/2021,08/08/2021,fiction,fiction (#191),read,"I enjoyed this slightly less than All the Light We Cannot See, but it was still masterfully written - very evocative and vivid. You could say this novel is about time, memory, and finding joy in the small details. Or you could say it's about a weird hydrologist who abandons his family after dreaming of his baby daughter's death in a flood. Rather than stay and see his nightmare fulfilled, he flees the country and ends up in the West Indies where he ruminates for 25 years. Eventually he makes his way back to the states where he seeks out his adult daughter. The story and its protagonist were odd to say the least, but Doerr has a great way of tying things together and creating vivid imagery. ",,,1,0,,,,,,,
55745867,Nervous Conditions,Tsitsi Dangarembga,"Dangarembga, Tsitsi",,,,4,4.04,Faber & Faber,Kindle Edition,212,2020,1988,06/08/2021,01/08/2021,fiction,fiction (#190),read,"I really enjoyed this. Set in 1960s Zimbabwe, Tambu gets a life-changing opportunity to receive an education paid for by her uncle Babamukuru, arch-patriarch of the family. The story is told retrospectively and reads as a bildungsroman, but its themes include social mobility, culture clashes, and gender roles. ",,,1,0,,,,,,,
4806,Longitude: The True Story of a Lone Genius Who Solved the Greatest Scientific Problem of His Time,Dava Sobel,"Sobel, Dava",Neil Armstrong,802714625,9.78E+12,4,3.98,Walker Books,Hardcover,184,2005,1995,31/07/2021,27/07/2021,"non-fiction, history","non-fiction (#128), history (#22)",read,,,,1,0,,,,,,,
23364847,Daily Rituals: How Artists Work,Mason Currey,"Currey, Mason",,,9.78E+12,3,3.65,Picador,Paperback,280,2013,2013,25/07/2021,17/07/2021,non-fiction,non-fiction (#127),read,"I was going to accuse this book of being too thinly spread and not offering enough depth of insight. But then it's my own fault for not reading the book's synopsis properly: it covers the daily rituals of over 160 people in only 236 pages. These are vignettes into the working habits of famous writers, artists, and intellectuals, sometimes only half a page long. I think what would be more interesting would be a book that tries to synthesise commonalities in these routines and gives more in-depth case studies of interesting or outlying individuals. ",,,1,0,,,,,,,
821893,Long Walk to Freedom,Nelson Mandela,"Mandela, Nelson",,349106533,9.78E+12,5,4.35,Time Warner Books Uk,Paperback,751,1995,1994,22/07/2021,12/06/2021,"non-fiction, south-africa","non-fiction (#126), south-africa (#1)",read,"What a life, what a story, what a struggle...",,,1,0,,,,,,,
1425589,The Good Terrorist,Doris Lessing,"Lessing, Doris",,586068805,9.78E+12,4,3.68,Grafton Books,Mass Market Paperback,370,1986,1985,17/07/2021,05/07/2021,fiction,fiction (#189),read,"I'd say that The Good Terrorist is a novel about identity conflict and the banality of revolution. It follows a group of squatters in 1980s London and focuses primarily on Alice Mellings, who comes from a privileged social background. Although she decries capitalism, Alice is also house proud and survives by stealing. She finds herself in the role of a responsible adult or housewife, cooking and cleaning for the others while they pursue their revolutionary activities. The 'comrades' of the squat are torn between allegiance to the IRA and Russia. I didn't really know where the novel was going, and it felt a little stodgy at times with the level of detail and minutiae of house-squat bureaucracy. However, the characterisation was excellent and by the end I almost felt like a member of the squat myself. ",,,1,0,,,,,,,
13104064,Post Office,Charles Bukowski,"Bukowski, Charles",,,,2,3.94,,,162,1971,1971,03/07/2021,28/06/2021,fiction,fiction (#188),read,What was the point of this???,,,1,0,,,,,,,
43264734,"The Family Upstairs (The Family Upstairs, #1)",Lisa Jewell,"Jewell, Lisa",,,,4,3.97,Cornerstone Digital,Kindle Edition,442,2019,2019,28/06/2021,19/06/2021,fiction,fiction (#187),read,,,,1,0,,,,,,,
35248417,Everybody Lies: What the Internet Can Tell Us About Who We Really Are,Seth Stephens-Davidowitz,"Stephens-Davidowitz, Seth",,1408894696,,2,3.91,Bloomsbury Publishing,Kindle Edition,353,2017,2017,18/06/2021,10/06/2021,non-fiction,non-fiction (#125),read,"I don't particularly rate this book. It read like an overly long blogpost, with jaunty, clickbaity language to match. In fact, I think some of the studies in this book would have been better written up as blog articles, making use of multimedia to tell the story. Stephens-Davidowitz does spend a little bit of time discussing some of the issues with Big Data (e.g. the curse of dimensionality), but this cursory and comes too late in the book after he's tried to wow the reader with his attempt at Freakonomics. ",,,1,0,,,,,,,
15923793,The Grass is Singing,Doris Lessing,"Lessing, Doris",,7498802,9.78E+12,4,3.83,HarperCollins,Paperback,208,2013,1950,09/06/2021,04/06/2021,fiction,fiction (#186),read,"I wouldn't know where to start with a review for this one. I thought it was masterful and with excellent characterisation. Obviously it's a critique of apartheid and white colonialism, and for me it was a book about hatred and revenge. Mary hates society for pressuring her to marry and abandon her independent lifestyle; she's spitefully indifferent to her unambitious and flighty farmer husband Dick; she loathes her uneventful life on the farm, and she has disdain and even disgust for the 'natives'. I think she suffers cognitive dissonance when she comes to realise that the native houseboy, Moses, actually shows compassion (in caring for Dick when he falls ill) and even showing concern for Mary's own wellbeing. But he can't forget how she treated him in the past, and takes an opportunity to seek revenge. Not necessarily an easy read, but very well crafted and a lot to think about.",,,1,0,,,,,,,
